{
  "case_id": "SELT-PROT-0004",
  "dataset_version": "0.1.0",
  "sci_evo_type": "scientific_evolution_trace",
  "domain": [
    "protein_design",
    "antibody_engineering",
    "large_language_models",
    "industrial_biomanufacturing"
  ],
  "source": {
    "title": "AI-enabled Alkaline-resistant Evolution of Protein to Apply in Mass Production",
    "venue": "eLife",
    "year": 2025,
    "doi": "10.7554/eLife.102788.3",
    "url": "https://doi.org/10.7554/eLife.102788.3",
    "document_path": "source_papers/SELT-PROT-0004.pdf",
    "license_status": "explicit_open_license_cc_by",
    "mineru_artifact": {
      "markdown_path": "mineru_artifacts/SELT-PROT-0004/full.md",
      "content_json_path": "mineru_artifacts/SELT-PROT-0004/content_list.json",
      "content_list_v2_path": "mineru_artifacts/SELT-PROT-0004/content_list_v2.json",
      "layout_json_path": "mineru_artifacts/SELT-PROT-0004/layout.json",
      "images_dir": "",
      "tables_dir": ""
    }
  },
  "initial_request": {
    "target_name": "Alkali-resistant VHH antibody ligand for industrial growth-hormone purification",
    "input_data": "A VHH antibody sequence binding growth hormone, Pro-PRIME protein language model scores, single-point mutant alkali-resistance and melting-temperature measurements, and industrial affinity-chromatography cleaning requirements using strong alkaline treatment.",
    "user_intent": "Use an AI-guided protein engineering loop to evolve an antibody ligand that keeps growth-hormone binding after harsh alkaline cleaning, while also preserving or improving thermal stability and affinity for production use.",
    "quantifiable_goal": "Complete a two-round design campaign with only dozens of experimentally tested mutants, identify multi-point variants with stronger alkali resistance and thermal stability than wild type and best single mutants, and validate that the selected ligand remains usable across repeated industrial purification cycles.",
    "evidence": [
      {
        "source_doc": "https://elifesciences.org/articles/102788.pdf",
        "page": 2,
        "locator": "Abstract and study overview",
        "support": "The paper describes using Pro-PRIME to improve alkali resistance, thermal stability, and affinity of a growth-hormone-binding VHH antibody through two rounds of design."
      }
    ]
  },
  "agent_trajectory": [
    {
      "step_index": 1,
      "phase": "industrial_problem_definition",
      "thought": "[Background] Known / completed: Affinity chromatography ligands for growth hormone face alkaline cleaning conditions that most natural proteins do not tolerate well. [Gap] Missing / unresolved: Whether a language model trained mostly on natural protein sequences can design resistance to such rare, unnatural industrial stress. [Decision] Frame alkali resistance as the primary target while tracking thermal stability and affinity as coupled constraints, because a production ligand must survive cleaning without losing binding function.",
      "action": "analysis",
      "tool": {
        "name": "Industrial fitness-objective decomposition",
        "version": "",
        "category": "problem_formulation"
      },
      "parameters": {
        "protein": "growth-hormone-binding VHH antibody",
        "primary_stress": "alkaline cleaning",
        "secondary_constraints": [
          "thermal stability",
          "target affinity",
          "dynamic binding capacity"
        ]
      },
      "observation": "The engineering objective was converted into a multi-property fitness problem: retain target binding after high-pH exposure while keeping the ligand stable enough for repeated industrial cycles.",
      "outcome_type": "success",
      "valid": true,
      "references": [],
      "evidence": [
        {
          "source_doc": "https://elifesciences.org/articles/102788.pdf",
          "page": 1,
          "locator": "eLife Assessment",
          "support": "The assessment states that Pro-PRIME was applied to engineer VHH antibodies with enhanced stability for extreme industrial environments."
        },
        {
          "source_doc": "https://elifesciences.org/articles/102788.pdf",
          "page": 2,
          "locator": "Introduction: industrial challenge",
          "support": "The paper explains that industrial proteins often need to work under extreme pH or temperature conditions that are scarce in natural training data."
        }
      ]
    },
    {
      "step_index": 2,
      "phase": "zero_shot_single_mutant_design",
      "thought": "[Background] Known / completed: The target VHH sequence and industrial fitness objectives are defined, but no task-specific alkali-resistance training data are available yet. [Gap] Missing / unresolved: Which single amino-acid changes are worth spending wet-lab budget on. [Decision] Use Pro-PRIME in a zero-shot setting to score saturated single-point mutants and select the top 45 candidates for experimental testing, accepting that this first round mainly builds a compact empirical map.",
      "action": "dry_experiment",
      "tool": {
        "name": "Pro-PRIME zero-shot single-mutant scoring",
        "version": "",
        "category": "protein_language_model"
      },
      "parameters": {
        "design_space": "saturated single-point mutations of the VHH antibody",
        "selection_budget": 45,
        "training_data_for_task": "none at first round"
      },
      "observation": "Pro-PRIME produced a ranked single-mutant shortlist, allowing the team to test only 45 candidates rather than launching a broad random or rational-design screen.",
      "outcome_type": "success",
      "valid": true,
      "references": [],
      "evidence": [
        {
          "source_doc": "https://elifesciences.org/articles/102788.pdf",
          "page": 3,
          "locator": "Single-point mutant design paragraph",
          "support": "The paper states that Pro-PRIME scored single-site saturated mutants and that the top 45 VHH single-point mutants were selected for testing."
        }
      ]
    },
    {
      "step_index": 3,
      "phase": "single_mutant_wet_validation",
      "thought": "[Background] Known / completed: Forty-five single mutants have been selected by zero-shot language-model scoring. [Gap] Missing / unresolved: Which mutations actually improve alkali resistance, melting temperature, and affinity under assay conditions. [Decision] Express and test the 45 variants after alkaline treatment, measuring EC50-linked affinity and melting temperature so the first round can both identify useful hits and provide training data for the harder combinatorial round.",
      "action": "wet_experiment",
      "tool": {
        "name": "Alkali exposure, affinity assay, and melting-temperature measurement",
        "version": "",
        "category": "wet_lab_screening"
      },
      "parameters": {
        "tested_single_point_mutants": 45,
        "alkali_treatment": "0.3 M NaOH for 24 h; selected variants also tested at 0.5 M NaOH",
        "measurements": [
          "EC50 after alkali treatment",
          "melting temperature",
          "affinity before alkali treatment"
        ]
      },
      "observation": "Fifteen single-point mutants improved alkali resistance, 35 improved melting temperature, and six mutants improved all three tracked properties, creating a high-value empirical set for round-two model tuning.",
      "outcome_type": "success",
      "valid": true,
      "references": [],
      "evidence": [
        {
          "source_doc": "https://elifesciences.org/articles/102788.pdf",
          "page": 3,
          "locator": "Single-point mutant experimental results",
          "support": "The paper reports that 15 of 45 single mutants showed higher alkali resistance, 35 showed higher Tm, and six improved alkali resistance, thermal stability, and affinity."
        }
      ]
    },
    {
      "step_index": 4,
      "phase": "fine_tuned_multipoint_design",
      "thought": "[Background] Known / completed: Round one produced measured single-mutant fitness data, but multi-point combinations introduce epistasis and a much larger search space. [Gap] Missing / unresolved: Which combinations escape local optima while maintaining thermal stability. [Decision] Fine-tune Pro-PRIME separately on alkali-resistance and Tm data from the single-mutant campaign, then prioritize multi-point variants with high alkali-resistance scores and non-decreased Tm scores.",
      "action": "dry_experiment",
      "tool": {
        "name": "Fine-tuned Pro-PRIME multi-point mutant design",
        "version": "",
        "category": "protein_language_model_fine_tuning"
      },
      "parameters": {
        "fine_tuning_data": [
          "single-mutant alkali-resistance measurements",
          "single-mutant melting-temperature measurements"
        ],
        "selected_multi_point_mutants": 20,
        "selection_rule": "high alkali-resistance score with Tm score no lower than wild type"
      },
      "observation": "Fine-tuned Pro-PRIME selected 20 multi-point mutants, and five surpassed the best single-point mutant in alkali resistance while multi-point Tm values were generally higher.",
      "outcome_type": "success",
      "valid": true,
      "references": [],
      "evidence": [
        {
          "source_doc": "https://elifesciences.org/articles/102788.pdf",
          "page": 5,
          "locator": "Multi-point design paragraph",
          "support": "The paper states that two Pro-PRIME models were trained with single-mutant alkali-resistance and Tm data, 20 multi-point mutants were selected, and five exceeded the best single-point mutant for alkali resistance."
        },
        {
          "source_doc": "https://elifesciences.org/articles/102788.pdf",
          "page": 5,
          "locator": "Zero-shot versus fine-tuned multi-point prediction",